{"$schema":"https://json-schema.org/draft/2020-12/schema","additionalProperties":false,"properties":{"artifacts":{"items":false,"maxItems":13,"minItems":13,"prefixItems":[{"additionalProperties":false,"properties":{"git_blob":{"const":"88c9bdfdd4802663ab1aa63785cced913403d1a3"},"path":{"const":"tests/test_pe4_ha_association_implementation_preparation.py"},"sha256":{"const":"3a1a6c40da47bc24557776a3faaecca195be1fe17eaffda66ca9347c42379095"}},"required":["git_blob","path","sha256"],"type":"object"},{"additionalProperties":false,"properties":{"git_blob":{"const":"3f2cc0ab7f0c62da94804d982d707416a8f8e533"},"path":{"const":"tests/test_pe4_ha_association_independent_production_acceptance_closure.py"},"sha256":{"const":"2101a39e02786c274d9c0178083491c74eabcd82e2fd87dbea21963b376f58c8"}},"required":["git_blob","path","sha256"],"type":"object"},{"additionalProperties":false,"properties":{"git_blob":{"const":"d6da5a2e53667fdc2dca005c66efc790ba63d3d1"},"path":{"const":"tests/test_pe4_ha_association_public_projection.py"},"sha256":{"const":"12e664a6d253d54ad8d57cfbebae01ddeecb90b046f8656bd60850c75d366a6d"}},"required":["git_blob","path","sha256"],"type":"object"},{"additionalProperties":false,"properties":{"git_blob":{"const":"47843753457867efc0fbdc046d48566e12ea22ac"},"path":{"const":"tests/test_pe4_ha_association_public_projection_deployment_baseline_correction.py"},"sha256":{"const":"437aaca4896851c5f3386963ddb2c5de68af3258259266dfea2b9a3e34077626"}},"required":["git_blob","path","sha256"],"type":"object"},{"additionalProperties":false,"properties":{"git_blob":{"const":"a3a6c3fc88ee69d0d77208d39866f29c4632d465"},"path":{"const":"tests/test_pe4_ha_association_public_projection_deployment_preparation.py"},"sha256":{"const":"6f2f5919450d56b86911a7ed9a4c171422a1a558ce78b28031f475612162154a"}},"required":["git_blob","path","sha256"],"type":"object"},{"additionalProperties":false,"properties":{"git_blob":{"const":"5db9918d99964993cc3cc60346485f927d5bbda2"},"path":{"const":"tests/test_pe4_ha_association_public_projection_posix_source_validation_closure.py"},"sha256":{"const":"9332594b6679ab07cbc3130ab042b7d0099671691064e1b7f18dce55c065749b"}},"required":["git_blob","path","sha256"],"type":"object"},{"additionalProperties":false,"properties":{"git_blob":{"const":"643060ba18f5dbf0b07d2f447eb96d6ef9436dfc"},"path":{"const":"tests/test_pe4_ha_association_public_projection_preparation.py"},"sha256":{"const":"f4490f98ba0001ce04bfac727efc290cb095cce710078aa7d980a8374bd5bcf1"}},"required":["git_blob","path","sha256"],"type":"object"},{"additionalProperties":false,"properties":{"git_blob":{"const":"9d78ecf1c2498289a7951dd857f8d8e49d75e4e4"},"path":{"const":"tests/test_pe4_ha_association_scheduler_deployment_closure.py"},"sha256":{"const":"f0ec2a5180f06d23553a67b3eb0491ac6db81ef6404cff284acdd93cff63b835"}},"required":["git_blob","path","sha256"],"type":"object"},{"additionalProperties":false,"properties":{"git_blob":{"const":"9f17238ad7823c52aece22faef43fd8492619089"},"path":{"const":"tests/test_pe4_ha_runtime_credential_provisioning.py"},"sha256":{"const":"f8c4a9a53301c9990c9d0076627f280065ccb45f59f224304cc7bf5a44ccd7e4"}},"required":["git_blob","path","sha256"],"type":"object"},{"additionalProperties":false,"properties":{"git_blob":{"const":"8b055a6fce49727fd0981341e4649d9f2a36004b"},"path":{"const":"tests/test_pe4_ha_runtime_credential_provisioning_closure.py"},"sha256":{"const":"49968aed0d43b115c47898e01ff4f85505534b8f492bf0c786f81afdac50c65d"}},"required":["git_blob","path","sha256"],"type":"object"},{"additionalProperties":false,"properties":{"git_blob":{"const":"9df2fb22e9065dea331060cb0fbef0c2c832b7ab"},"path":{"const":"docs/HIOC_MASTER_PLAN.md"},"sha256":{"const":"4b83fefdf98af862cd90ffb155d5a4ab0b066624c762033e1677fc4e2cb07e47"}},"required":["git_blob","path","sha256"],"type":"object"},{"additionalProperties":false,"properties":{"git_blob":{"const":"f98f669b822dfb75dd7b04bb82e4a5f16b4e511f"},"path":{"const":"docs/PE4_HOME_ASSISTANT_ASSOCIATION_PUBLIC_PROJECTION_TEST_BINDING_CORRECTION.md"},"sha256":{"const":"0462b0bd46abecbf66c6c19806ccde4d9a2e914afd16c11934cf6d2fa39fa9ca"}},"required":["git_blob","path","sha256"],"type":"object"},{"additionalProperties":false,"properties":{"git_blob":{"const":"7b9299988005ac50826ba8ada40e8096a0ce37bf"},"path":{"const":"tests/test_pe4_ha_association_public_projection_test_binding_correction.py"},"sha256":{"const":"a71bf07702d8b6439307e52031ae3a8debcf73f91f8ec7fa07e8753776ce47c5"}},"required":["git_blob","path","sha256"],"type":"object"}],"type":"array"},"binding_exception_paths":{"items":false,"maxItems":4,"minItems":4,"prefixItems":[{"const":"tests/test_pe4_ha_association_scheduler_deployment_closure.py"},{"const":"tests/test_pe4_ha_association_implementation_preparation.py"},{"const":"tests/test_pe4_ha_runtime_credential_provisioning.py"},{"const":"tests/test_pe4_ha_runtime_credential_provisioning_closure.py"}],"type":"array"},"closure_status":{"const":"NOT_CLOSED"},"codex_activity":{"additionalProperties":false,"properties":{"adapter_execution":{"const":false},"credential_access":{"const":false},"crontab_mutation":{"const":false},"deployment_execution":{"const":false},"ha_access":{"const":false},"inventory_execution":{"const":false},"mqtt_access":{"const":false},"pi3_access":{"const":false},"pi5_access":{"const":false},"production_mutation":{"const":false},"production_observation":{"const":false},"rollback":{"const":false}},"required":["adapter_execution","credential_access","crontab_mutation","deployment_execution","ha_access","inventory_execution","mqtt_access","pi3_access","pi5_access","production_mutation","production_observation","rollback"],"type":"object"},"correction_reason":{"const":"HISTORICAL_CHECKPOINT_TESTS_READ_EVOLVING_CURRENT_LIFECYCLE_DOCUMENT_WHILE_CURRENT_TEST_BYTES_ARE_FROZEN_TO_HISTORICAL_SOURCE"},"current_lifecycle_test_bindings":{"items":false,"maxItems":4,"minItems":4,"prefixItems":[{"additionalProperties":false,"properties":{"current_git_blob":{"const":"9d78ecf1c2498289a7951dd857f8d8e49d75e4e4"},"current_role":{"const":"CURRENT_LIFECYCLE_TEST_IDENTITY"},"current_runtime_authority":{"const":false},"current_sha256":{"const":"f0ec2a5180f06d23553a67b3eb0491ac6db81ef6404cff284acdd93cff63b835"},"historical_authority_commit":{"const":"eda070d4b06ccd7f562a74e1cb6b42cb5c630d67"},"historical_authority_record":{"const":"governance/pe4/pe4-ha-association-public-projection-implementation.json"},"historical_git_blob":{"const":"33cb0079175b779b777f953b1eb7dcd416c16186"},"historical_lifecycle_authority_commit":{"const":"eda070d4b06ccd7f562a74e1cb6b42cb5c630d67"},"historical_master_plan":{"additionalProperties":false,"properties":{"git_blob":{"const":"2dc320246cb21df98267b640da5253263511f3c7"},"path":{"const":"docs/HIOC_MASTER_PLAN.md"},"sha256":{"const":"0b927e93cdcdc5317ea5a365ba3406005c36da13c4d7398d9786defb67ae5af9"}},"required":["git_blob","path","sha256"],"type":"object"},"historical_only_original_value":{"const":false},"historical_provenance_preserved":{"const":true},"historical_sha256":{"const":"592159d3b2700298f59a77e1845c16217b529892b3545d09cb0208ceced8333b"},"path":{"const":"tests/test_pe4_ha_association_scheduler_deployment_closure.py"},"production_behavior_changed":{"const":false},"reason":{"const":"The Public Projection preparation commit introduced the scheduler test assertions for the public projection preparation lifecycle and PI3 source synchronization."},"runtime_behavior_changed":{"const":false}},"required":["current_git_blob","current_role","current_runtime_authority","current_sha256","historical_authority_commit","historical_authority_record","historical_git_blob","historical_lifecycle_authority_commit","historical_master_plan","historical_only_original_value","historical_provenance_preserved","historical_sha256","path","production_behavior_changed","reason","runtime_behavior_changed"],"type":"object"},{"additionalProperties":false,"properties":{"current_git_blob":{"const":"88c9bdfdd4802663ab1aa63785cced913403d1a3"},"current_role":{"const":"CURRENT_LIFECYCLE_TEST_IDENTITY"},"current_runtime_authority":{"const":false},"current_sha256":{"const":"3a1a6c40da47bc24557776a3faaecca195be1fe17eaffda66ca9347c42379095"},"historical_authority_commit":{"const":"c762745b428b28518cf4415f7399ff2cacb70c66"},"historical_authority_record":{"const":"governance/pe4/pe4-ha-association-public-projection-posix-source-validation-closure.json"},"historical_git_blob":{"const":"eaba01470e834f671b67fe66a97ff0d89e0d8af9"},"historical_lifecycle_authority_commit":{"const":"c762745b428b28518cf4415f7399ff2cacb70c66"},"historical_master_plan":{"additionalProperties":false,"properties":{"git_blob":{"const":"d2801f585ddfbf5d92c81d0f939131bd42b3d233"},"path":{"const":"docs/HIOC_MASTER_PLAN.md"},"sha256":{"const":"8d6c9b30ad1d26da15ad25224962afd36bd4cd582542c8a73e9399c6d664bf40"}},"required":["git_blob","path","sha256"],"type":"object"},"historical_only_original_value":{"const":false},"historical_provenance_preserved":{"const":true},"historical_sha256":{"const":"93f1b2dc6b6f468accb36efc87113c954585cd52959a3e6bc3314e450dfc40b5"},"path":{"const":"tests/test_pe4_ha_association_implementation_preparation.py"},"production_behavior_changed":{"const":false},"reason":{"const":"The Public Projection implementation commit introduced this test revision and its Public Projection implementation-era roadmap and next-task assertions."},"runtime_behavior_changed":{"const":false}},"required":["current_git_blob","current_role","current_runtime_authority","current_sha256","historical_authority_commit","historical_authority_record","historical_git_blob","historical_lifecycle_authority_commit","historical_master_plan","historical_only_original_value","historical_provenance_preserved","historical_sha256","path","production_behavior_changed","reason","runtime_behavior_changed"],"type":"object"},{"additionalProperties":false,"properties":{"current_git_blob":{"const":"9f17238ad7823c52aece22faef43fd8492619089"},"current_role":{"const":"CURRENT_LIFECYCLE_TEST_IDENTITY"},"current_runtime_authority":{"const":false},"current_sha256":{"const":"f8c4a9a53301c9990c9d0076627f280065ccb45f59f224304cc7bf5a44ccd7e4"},"historical_authority_commit":{"const":"c762745b428b28518cf4415f7399ff2cacb70c66"},"historical_authority_record":{"const":"governance/pe4/pe4-ha-association-public-projection-posix-source-validation-closure.json"},"historical_git_blob":{"const":"57d50f61bca6cf1d66249c8b820f344b070536d7"},"historical_lifecycle_authority_commit":{"const":"c762745b428b28518cf4415f7399ff2cacb70c66"},"historical_master_plan":{"additionalProperties":false,"properties":{"git_blob":{"const":"d2801f585ddfbf5d92c81d0f939131bd42b3d233"},"path":{"const":"docs/HIOC_MASTER_PLAN.md"},"sha256":{"const":"8d6c9b30ad1d26da15ad25224962afd36bd4cd582542c8a73e9399c6d664bf40"}},"required":["git_blob","path","sha256"],"type":"object"},"historical_only_original_value":{"const":false},"historical_provenance_preserved":{"const":true},"historical_sha256":{"const":"97781ec210f1da65550c3036be1520cd5f292d241d617cf1a1d57c4cd5f97864"},"path":{"const":"tests/test_pe4_ha_runtime_credential_provisioning.py"},"production_behavior_changed":{"const":false},"reason":{"const":"The Public Projection implementation commit introduced this test revision and its Public Projection implementation-era roadmap and next-task assertions."},"runtime_behavior_changed":{"const":false}},"required":["current_git_blob","current_role","current_runtime_authority","current_sha256","historical_authority_commit","historical_authority_record","historical_git_blob","historical_lifecycle_authority_commit","historical_master_plan","historical_only_original_value","historical_provenance_preserved","historical_sha256","path","production_behavior_changed","reason","runtime_behavior_changed"],"type":"object"},{"additionalProperties":false,"properties":{"current_git_blob":{"const":"8b055a6fce49727fd0981341e4649d9f2a36004b"},"current_role":{"const":"CURRENT_LIFECYCLE_TEST_IDENTITY"},"current_runtime_authority":{"const":false},"current_sha256":{"const":"49968aed0d43b115c47898e01ff4f85505534b8f492bf0c786f81afdac50c65d"},"historical_authority_commit":{"const":"c762745b428b28518cf4415f7399ff2cacb70c66"},"historical_authority_record":{"const":"governance/pe4/pe4-ha-association-public-projection-posix-source-validation-closure.json"},"historical_git_blob":{"const":"0bb18501c0219e1942b9c19ed3248627d590e6bd"},"historical_lifecycle_authority_commit":{"const":"c762745b428b28518cf4415f7399ff2cacb70c66"},"historical_master_plan":{"additionalProperties":false,"properties":{"git_blob":{"const":"d2801f585ddfbf5d92c81d0f939131bd42b3d233"},"path":{"const":"docs/HIOC_MASTER_PLAN.md"},"sha256":{"const":"8d6c9b30ad1d26da15ad25224962afd36bd4cd582542c8a73e9399c6d664bf40"}},"required":["git_blob","path","sha256"],"type":"object"},"historical_only_original_value":{"const":false},"historical_provenance_preserved":{"const":true},"historical_sha256":{"const":"ef6c0f8ff39ae50876c03875ef70f886caa2ee0cd3d488cf28b059c27600cbc1"},"path":{"const":"tests/test_pe4_ha_runtime_credential_provisioning_closure.py"},"production_behavior_changed":{"const":false},"reason":{"const":"The Public Projection implementation commit introduced this test revision and its Public Projection implementation-era roadmap and next-task assertions."},"runtime_behavior_changed":{"const":false}},"required":["current_git_blob","current_role","current_runtime_authority","current_sha256","historical_authority_commit","historical_authority_record","historical_git_blob","historical_lifecycle_authority_commit","historical_master_plan","historical_only_original_value","historical_provenance_preserved","historical_sha256","path","production_behavior_changed","reason","runtime_behavior_changed"],"type":"object"}],"type":"array"},"defect_class":{"const":"HISTORICAL_VS_CURRENT_LIFECYCLE_TEST_BINDING"},"draft_test_review":{"items":false,"maxItems":10,"minItems":10,"prefixItems":[{"additionalProperties":false,"properties":{"classification":{"const":"A. HISTORICAL_CURRENT_LIFECYCLE_BINDING_CORRECTION"},"path":{"const":"tests/test_pe4_ha_association_implementation_preparation.py"}},"required":["classification","path"],"type":"object"},{"additionalProperties":false,"properties":{"classification":{"const":"A. HISTORICAL_CURRENT_LIFECYCLE_BINDING_CORRECTION"},"path":{"const":"tests/test_pe4_ha_association_independent_production_acceptance_closure.py"}},"required":["classification","path"],"type":"object"},{"additionalProperties":false,"properties":{"classification":{"const":"B. PUBLIC_PROJECTION_CLOSURE_ONLY"},"path":{"const":"tests/test_pe4_ha_association_public_projection.py"}},"required":["classification","path"],"type":"object"},{"additionalProperties":false,"properties":{"classification":{"const":"A. HISTORICAL_CURRENT_LIFECYCLE_BINDING_CORRECTION"},"path":{"const":"tests/test_pe4_ha_association_public_projection_deployment_baseline_correction.py"}},"required":["classification","path"],"type":"object"},{"additionalProperties":false,"properties":{"classification":{"const":"A. HISTORICAL_CURRENT_LIFECYCLE_BINDING_CORRECTION"},"path":{"const":"tests/test_pe4_ha_association_public_projection_deployment_preparation.py"}},"required":["classification","path"],"type":"object"},{"additionalProperties":false,"properties":{"classification":{"const":"C. MIXED_CORRECTION_AND_CLOSURE"},"path":{"const":"tests/test_pe4_ha_association_public_projection_posix_source_validation_closure.py"}},"required":["classification","path"],"type":"object"},{"additionalProperties":false,"properties":{"classification":{"const":"A. HISTORICAL_CURRENT_LIFECYCLE_BINDING_CORRECTION"},"path":{"const":"tests/test_pe4_ha_association_public_projection_preparation.py"}},"required":["classification","path"],"type":"object"},{"additionalProperties":false,"properties":{"classification":{"const":"A. HISTORICAL_CURRENT_LIFECYCLE_BINDING_CORRECTION"},"path":{"const":"tests/test_pe4_ha_association_scheduler_deployment_closure.py"}},"required":["classification","path"],"type":"object"},{"additionalProperties":false,"properties":{"classification":{"const":"A. HISTORICAL_CURRENT_LIFECYCLE_BINDING_CORRECTION"},"path":{"const":"tests/test_pe4_ha_runtime_credential_provisioning.py"}},"required":["classification","path"],"type":"object"},{"additionalProperties":false,"properties":{"classification":{"const":"A. HISTORICAL_CURRENT_LIFECYCLE_BINDING_CORRECTION"},"path":{"const":"tests/test_pe4_ha_runtime_credential_provisioning_closure.py"}},"required":["classification","path"],"type":"object"}],"type":"array"},"forbidden_exception_classes":{"items":false,"maxItems":12,"minItems":12,"prefixItems":[{"const":"runtime"},{"const":"production"},{"const":"private_state"},{"const":"schema"},{"const":"tool"},{"const":"release"},{"const":"dashboard"},{"const":"configuration"},{"const":"operational_implementation"},{"const":"document"},{"const":"wildcard"},{"const":"directory"}],"type":"array"},"immutable_historical_authorities":{"items":false,"maxItems":4,"minItems":4,"prefixItems":[{"additionalProperties":false,"properties":{"git_blob":{"const":"cce1cc08782816c3d33c24c5c82a74d8fbd5ff4c"},"path":{"const":"governance/pe4/pe4-ha-association-public-projection-implementation.json"},"sha256":{"const":"ad249a3204f86b04d91a94818c705b456151f571ad36814c204b35128f5d4b54"}},"required":["git_blob","path","sha256"],"type":"object"},{"additionalProperties":false,"properties":{"git_blob":{"const":"2e9db95616dc3afefd35fbd9a5cd0d9e6fa5f142"},"path":{"const":"governance/pe4/pe4-ha-association-public-projection-implementation.schema.json"},"sha256":{"const":"a310c9168165ebf42d4fab63be184af1072ca1e3b5e6872c2c407ca2b0281cf6"}},"required":["git_blob","path","sha256"],"type":"object"},{"additionalProperties":false,"properties":{"git_blob":{"const":"60ee2420764d8e4d12084521a1efab74e92ffed3"},"path":{"const":"governance/pe4/pe4-ha-association-public-projection-posix-source-validation-closure.json"},"sha256":{"const":"87c7a43fe47dab4d55d8644e76f9946ac623efd0715be95286838ccede4981a5"}},"required":["git_blob","path","sha256"],"type":"object"},{"additionalProperties":false,"properties":{"git_blob":{"const":"67d63ffe441306b9d38a9226a5811b67e3e663ad"},"path":{"const":"governance/pe4/pe4-ha-association-public-projection-posix-source-validation-closure.schema.json"},"sha256":{"const":"2519dd30b290ca1f363f0899b32a5f4e4ce64492169ab0abd983c0679c07ee13"}},"required":["git_blob","path","sha256"],"type":"object"}],"type":"array"},"next_action":{"const":"SEPARATELY_AUTHORIZE_RESUMPTION_OF_PRESERVED_PUBLIC_PROJECTION_CLOSURE_DRAFT"},"no_assumptions_policy":{"const":"UNKNOWN -> VERIFY -> ESTABLISH EVIDENCE -> DECIDE -> ACT"},"pe4_status":{"const":"NOT_COMPLETE"},"pe5_status":{"const":"NOT_STARTED"},"phase_7a_status":{"const":"ACTIVE"},"predecessor_commit":{"const":"c7db29f795909d7926e36c02f1166034bcebb8b0"},"production_evidence":{"const":"OPERATOR_SUPPLIED_CLOSURE_DRAFT_NOT_YET_ACCEPTED"},"record_type":{"const":"PE4_HA_ASSOCIATION_PUBLIC_PROJECTION_TEST_BINDING_CORRECTION"},"status":{"const":"PASS_CLOSED"}},"required":["artifacts","binding_exception_paths","closure_status","codex_activity","correction_reason","current_lifecycle_test_bindings","defect_class","draft_test_review","forbidden_exception_classes","immutable_historical_authorities","next_action","no_assumptions_policy","pe4_status","pe5_status","phase_7a_status","predecessor_commit","production_evidence","record_type","status"],"type":"object"}
