{"artifacts":[{"git_blob":"88c9bdfdd4802663ab1aa63785cced913403d1a3","path":"tests/test_pe4_ha_association_implementation_preparation.py","sha256":"3a1a6c40da47bc24557776a3faaecca195be1fe17eaffda66ca9347c42379095"},{"git_blob":"3f2cc0ab7f0c62da94804d982d707416a8f8e533","path":"tests/test_pe4_ha_association_independent_production_acceptance_closure.py","sha256":"2101a39e02786c274d9c0178083491c74eabcd82e2fd87dbea21963b376f58c8"},{"git_blob":"d6da5a2e53667fdc2dca005c66efc790ba63d3d1","path":"tests/test_pe4_ha_association_public_projection.py","sha256":"12e664a6d253d54ad8d57cfbebae01ddeecb90b046f8656bd60850c75d366a6d"},{"git_blob":"47843753457867efc0fbdc046d48566e12ea22ac","path":"tests/test_pe4_ha_association_public_projection_deployment_baseline_correction.py","sha256":"437aaca4896851c5f3386963ddb2c5de68af3258259266dfea2b9a3e34077626"},{"git_blob":"a3a6c3fc88ee69d0d77208d39866f29c4632d465","path":"tests/test_pe4_ha_association_public_projection_deployment_preparation.py","sha256":"6f2f5919450d56b86911a7ed9a4c171422a1a558ce78b28031f475612162154a"},{"git_blob":"5db9918d99964993cc3cc60346485f927d5bbda2","path":"tests/test_pe4_ha_association_public_projection_posix_source_validation_closure.py","sha256":"9332594b6679ab07cbc3130ab042b7d0099671691064e1b7f18dce55c065749b"},{"git_blob":"643060ba18f5dbf0b07d2f447eb96d6ef9436dfc","path":"tests/test_pe4_ha_association_public_projection_preparation.py","sha256":"f4490f98ba0001ce04bfac727efc290cb095cce710078aa7d980a8374bd5bcf1"},{"git_blob":"9d78ecf1c2498289a7951dd857f8d8e49d75e4e4","path":"tests/test_pe4_ha_association_scheduler_deployment_closure.py","sha256":"f0ec2a5180f06d23553a67b3eb0491ac6db81ef6404cff284acdd93cff63b835"},{"git_blob":"9f17238ad7823c52aece22faef43fd8492619089","path":"tests/test_pe4_ha_runtime_credential_provisioning.py","sha256":"f8c4a9a53301c9990c9d0076627f280065ccb45f59f224304cc7bf5a44ccd7e4"},{"git_blob":"8b055a6fce49727fd0981341e4649d9f2a36004b","path":"tests/test_pe4_ha_runtime_credential_provisioning_closure.py","sha256":"49968aed0d43b115c47898e01ff4f85505534b8f492bf0c786f81afdac50c65d"},{"git_blob":"9df2fb22e9065dea331060cb0fbef0c2c832b7ab","path":"docs/HIOC_MASTER_PLAN.md","sha256":"4b83fefdf98af862cd90ffb155d5a4ab0b066624c762033e1677fc4e2cb07e47"},{"git_blob":"f98f669b822dfb75dd7b04bb82e4a5f16b4e511f","path":"docs/PE4_HOME_ASSISTANT_ASSOCIATION_PUBLIC_PROJECTION_TEST_BINDING_CORRECTION.md","sha256":"0462b0bd46abecbf66c6c19806ccde4d9a2e914afd16c11934cf6d2fa39fa9ca"},{"git_blob":"7b9299988005ac50826ba8ada40e8096a0ce37bf","path":"tests/test_pe4_ha_association_public_projection_test_binding_correction.py","sha256":"a71bf07702d8b6439307e52031ae3a8debcf73f91f8ec7fa07e8753776ce47c5"}],"binding_exception_paths":["tests/test_pe4_ha_association_scheduler_deployment_closure.py","tests/test_pe4_ha_association_implementation_preparation.py","tests/test_pe4_ha_runtime_credential_provisioning.py","tests/test_pe4_ha_runtime_credential_provisioning_closure.py"],"closure_status":"NOT_CLOSED","codex_activity":{"adapter_execution":false,"credential_access":false,"crontab_mutation":false,"deployment_execution":false,"ha_access":false,"inventory_execution":false,"mqtt_access":false,"pi3_access":false,"pi5_access":false,"production_mutation":false,"production_observation":false,"rollback":false},"correction_reason":"HISTORICAL_CHECKPOINT_TESTS_READ_EVOLVING_CURRENT_LIFECYCLE_DOCUMENT_WHILE_CURRENT_TEST_BYTES_ARE_FROZEN_TO_HISTORICAL_SOURCE","current_lifecycle_test_bindings":[{"current_git_blob":"9d78ecf1c2498289a7951dd857f8d8e49d75e4e4","current_role":"CURRENT_LIFECYCLE_TEST_IDENTITY","current_runtime_authority":false,"current_sha256":"f0ec2a5180f06d23553a67b3eb0491ac6db81ef6404cff284acdd93cff63b835","historical_authority_commit":"eda070d4b06ccd7f562a74e1cb6b42cb5c630d67","historical_authority_record":"governance/pe4/pe4-ha-association-public-projection-implementation.json","historical_git_blob":"33cb0079175b779b777f953b1eb7dcd416c16186","historical_lifecycle_authority_commit":"eda070d4b06ccd7f562a74e1cb6b42cb5c630d67","historical_master_plan":{"git_blob":"2dc320246cb21df98267b640da5253263511f3c7","path":"docs/HIOC_MASTER_PLAN.md","sha256":"0b927e93cdcdc5317ea5a365ba3406005c36da13c4d7398d9786defb67ae5af9"},"historical_only_original_value":false,"historical_provenance_preserved":true,"historical_sha256":"592159d3b2700298f59a77e1845c16217b529892b3545d09cb0208ceced8333b","path":"tests/test_pe4_ha_association_scheduler_deployment_closure.py","production_behavior_changed":false,"reason":"The Public Projection preparation commit introduced the scheduler test assertions for the public projection preparation lifecycle and PI3 source synchronization.","runtime_behavior_changed":false},{"current_git_blob":"88c9bdfdd4802663ab1aa63785cced913403d1a3","current_role":"CURRENT_LIFECYCLE_TEST_IDENTITY","current_runtime_authority":false,"current_sha256":"3a1a6c40da47bc24557776a3faaecca195be1fe17eaffda66ca9347c42379095","historical_authority_commit":"c762745b428b28518cf4415f7399ff2cacb70c66","historical_authority_record":"governance/pe4/pe4-ha-association-public-projection-posix-source-validation-closure.json","historical_git_blob":"eaba01470e834f671b67fe66a97ff0d89e0d8af9","historical_lifecycle_authority_commit":"c762745b428b28518cf4415f7399ff2cacb70c66","historical_master_plan":{"git_blob":"d2801f585ddfbf5d92c81d0f939131bd42b3d233","path":"docs/HIOC_MASTER_PLAN.md","sha256":"8d6c9b30ad1d26da15ad25224962afd36bd4cd582542c8a73e9399c6d664bf40"},"historical_only_original_value":false,"historical_provenance_preserved":true,"historical_sha256":"93f1b2dc6b6f468accb36efc87113c954585cd52959a3e6bc3314e450dfc40b5","path":"tests/test_pe4_ha_association_implementation_preparation.py","production_behavior_changed":false,"reason":"The Public Projection implementation commit introduced this test revision and its Public Projection implementation-era roadmap and next-task assertions.","runtime_behavior_changed":false},{"current_git_blob":"9f17238ad7823c52aece22faef43fd8492619089","current_role":"CURRENT_LIFECYCLE_TEST_IDENTITY","current_runtime_authority":false,"current_sha256":"f8c4a9a53301c9990c9d0076627f280065ccb45f59f224304cc7bf5a44ccd7e4","historical_authority_commit":"c762745b428b28518cf4415f7399ff2cacb70c66","historical_authority_record":"governance/pe4/pe4-ha-association-public-projection-posix-source-validation-closure.json","historical_git_blob":"57d50f61bca6cf1d66249c8b820f344b070536d7","historical_lifecycle_authority_commit":"c762745b428b28518cf4415f7399ff2cacb70c66","historical_master_plan":{"git_blob":"d2801f585ddfbf5d92c81d0f939131bd42b3d233","path":"docs/HIOC_MASTER_PLAN.md","sha256":"8d6c9b30ad1d26da15ad25224962afd36bd4cd582542c8a73e9399c6d664bf40"},"historical_only_original_value":false,"historical_provenance_preserved":true,"historical_sha256":"97781ec210f1da65550c3036be1520cd5f292d241d617cf1a1d57c4cd5f97864","path":"tests/test_pe4_ha_runtime_credential_provisioning.py","production_behavior_changed":false,"reason":"The Public Projection implementation commit introduced this test revision and its Public Projection implementation-era roadmap and next-task assertions.","runtime_behavior_changed":false},{"current_git_blob":"8b055a6fce49727fd0981341e4649d9f2a36004b","current_role":"CURRENT_LIFECYCLE_TEST_IDENTITY","current_runtime_authority":false,"current_sha256":"49968aed0d43b115c47898e01ff4f85505534b8f492bf0c786f81afdac50c65d","historical_authority_commit":"c762745b428b28518cf4415f7399ff2cacb70c66","historical_authority_record":"governance/pe4/pe4-ha-association-public-projection-posix-source-validation-closure.json","historical_git_blob":"0bb18501c0219e1942b9c19ed3248627d590e6bd","historical_lifecycle_authority_commit":"c762745b428b28518cf4415f7399ff2cacb70c66","historical_master_plan":{"git_blob":"d2801f585ddfbf5d92c81d0f939131bd42b3d233","path":"docs/HIOC_MASTER_PLAN.md","sha256":"8d6c9b30ad1d26da15ad25224962afd36bd4cd582542c8a73e9399c6d664bf40"},"historical_only_original_value":false,"historical_provenance_preserved":true,"historical_sha256":"ef6c0f8ff39ae50876c03875ef70f886caa2ee0cd3d488cf28b059c27600cbc1","path":"tests/test_pe4_ha_runtime_credential_provisioning_closure.py","production_behavior_changed":false,"reason":"The Public Projection implementation commit introduced this test revision and its Public Projection implementation-era roadmap and next-task assertions.","runtime_behavior_changed":false}],"defect_class":"HISTORICAL_VS_CURRENT_LIFECYCLE_TEST_BINDING","draft_test_review":[{"classification":"A. HISTORICAL_CURRENT_LIFECYCLE_BINDING_CORRECTION","path":"tests/test_pe4_ha_association_implementation_preparation.py"},{"classification":"A. HISTORICAL_CURRENT_LIFECYCLE_BINDING_CORRECTION","path":"tests/test_pe4_ha_association_independent_production_acceptance_closure.py"},{"classification":"B. PUBLIC_PROJECTION_CLOSURE_ONLY","path":"tests/test_pe4_ha_association_public_projection.py"},{"classification":"A. HISTORICAL_CURRENT_LIFECYCLE_BINDING_CORRECTION","path":"tests/test_pe4_ha_association_public_projection_deployment_baseline_correction.py"},{"classification":"A. HISTORICAL_CURRENT_LIFECYCLE_BINDING_CORRECTION","path":"tests/test_pe4_ha_association_public_projection_deployment_preparation.py"},{"classification":"C. MIXED_CORRECTION_AND_CLOSURE","path":"tests/test_pe4_ha_association_public_projection_posix_source_validation_closure.py"},{"classification":"A. HISTORICAL_CURRENT_LIFECYCLE_BINDING_CORRECTION","path":"tests/test_pe4_ha_association_public_projection_preparation.py"},{"classification":"A. HISTORICAL_CURRENT_LIFECYCLE_BINDING_CORRECTION","path":"tests/test_pe4_ha_association_scheduler_deployment_closure.py"},{"classification":"A. HISTORICAL_CURRENT_LIFECYCLE_BINDING_CORRECTION","path":"tests/test_pe4_ha_runtime_credential_provisioning.py"},{"classification":"A. HISTORICAL_CURRENT_LIFECYCLE_BINDING_CORRECTION","path":"tests/test_pe4_ha_runtime_credential_provisioning_closure.py"}],"forbidden_exception_classes":["runtime","production","private_state","schema","to